{
  "contractId": "C-006",
  "contractVersion": "1.0.0",
  "describedContractId": "P-001",
  "describedContractName": "Presentation capability manifest",
  "describedVersion": "1.0.0",
  "status": "agreed",
  "schemaId": "urn:public-purpose-lab:contract:P-001:1.0.0",
  "compatibilityMode": "none",
  "effectiveFrom": "2026-08-27T12:00:00Z",
  "examples": ["contracts/presentation/examples/p-001-assurance-surface.json"],
  "producerExpectations": [
    "Declare semantic views and bounded context keys without browser routes."
  ],
  "consumerExpectations": [
    "Admit only compatible synthetic information and current application releases."
  ],
  "evidence": []
}
