{
  "contractId": "C-006",
  "contractVersion": "1.0.0",
  "describedContractId": "C-001",
  "describedContractName": "Interaction envelope",
  "describedVersion": "1.0.0",
  "status": "agreed",
  "schemaId": "urn:public-purpose-lab:contract:C-001:1.0.0",
  "compatibilityMode": "none",
  "effectiveFrom": "2026-08-25T00:00:00Z",
  "examples": ["contracts/common/examples/c-001-m1-conformance-command.json"],
  "producerExpectations": [
    "Preserve exact authority, classification, correlation and idempotency semantics"
  ],
  "consumerExpectations": [
    "Refuse undeclared versions and evaluate authority at the receiving boundary"
  ],
  "evidence": []
}
